{
  "schema_version": "v1",
  "id": "pf-v2-014-first-apply",
  "kind": "deployment-preflight",
  "created_at": "2026-08-24T12:00:00Z",
  "correlation_id": "v2-012-gcp-deployment-design",
  "task_id": "V2-014",
  "target": {
    "environment": "live",
    "project_ref": "al-acme-corp-live",
    "installation_id": "acme-corp",
    "region": "us-central1",
    "service_name": "control-plane",
    "image_digest": "6f4a3c2b1e0d9f8a7b6c5d4e3f2a1b0c9d8e7f6a5b4c3d2e1f0a9b8c7d6e5f4a",
    "plan_digest": "1a2b3c4d5e6f7a8b9c0d1e2f3a4b5c6d7e8f9a0b1c2d3e4f5a6b7c8d9e0f1a2b"
  },
  "limits": [
    {"resource": "firestore-reads-per-day", "ceiling": 25000, "unit": "operations", "window": "day", "enforced_by": "internal/quota.Budget.Reads", "fail_closed": true},
    {"resource": "firestore-writes-per-day", "ceiling": 10000, "unit": "operations", "window": "day", "enforced_by": "internal/quota.Budget.Writes", "fail_closed": true},
    {"resource": "firestore-deletes-per-day", "ceiling": 10000, "unit": "operations", "window": "day", "enforced_by": "internal/quota.Budget.Deletes", "fail_closed": true},
    {"resource": "firestore-stored-bytes", "ceiling": 268435456, "unit": "bytes", "window": "total", "enforced_by": "internal/quota.StorageBudget.PayloadBytes", "fail_closed": true},
    {"resource": "cloud-run-instance-seconds-per-month", "ceiling": 360000, "unit": "instance-seconds", "window": "month", "enforced_by": "infra/main.tf cpu=0.08 memory=512Mi", "fail_closed": true},
    {"resource": "cloud-run-requests-per-month", "ceiling": 1000000, "unit": "requests", "window": "month", "enforced_by": "Cloud Run always-free monthly request tier", "fail_closed": true},
    {"resource": "cloud-scheduler-jobs", "ceiling": 0, "unit": "jobs", "window": "total", "enforced_by": "enable_reconcile_scheduler=false", "fail_closed": true}
  ],
  "rollback": {
    "trigger": "the applied revision fails verification or serves degraded traffic",
    "argv": ["tofu", "-chdir=infra", "apply", "-input=false", "build/rollback.tfplan"],
    "completion_conditions": [
      "100 percent of traffic is served by the revision built from the previous digest",
      "tofu plan -refresh-only -detailed-exitcode exits 0",
      "/healthz returns 200 through IAP",
      "a sampled read of canonical Firestore documents has the same content digest as before the rollback"
    ]
  },
  "verification": [
    {"name": "no drift", "argv": ["tofu", "-chdir=infra", "plan", "-refresh-only", "-detailed-exitcode"], "expected": "exit code 0", "read_only": true},
    {"name": "unauthenticated request is refused", "argv": ["curl", "-sS", "-o", "/dev/null", "-w", "%{http_code}", "https://control-plane.example.run.app/"], "expected": "302 or 403, never 200", "read_only": true}
  ],
  "approval": {
    "approver": "owner@example.com",
    "approved_at": "2026-08-24T11:55:00Z",
    "approval_reference": "deploy-approval-2026-08-24-01",
    "scope": "first apply of the al-acme-corp-live control plane at plan_digest 1a2b3c4d5e6f7a8b9c0d1e2f3a4b5c6d7e8f9a0b1c2d3e4f5a6b7c8d9e0f1a2b"
  }
}
